{
  "certification_id": "SC-CERT-2026-0001",
  "generated_date": "2026-07-13",
  "total_items": 3,
  "items": [
    {
      "evidence_id": "EVD-0001",
      "title": "Source Code Review Report",
      "type": "Review Report",
      "description": "N/A",
      "location": "https://evidence.satoshium.example/EVD-0000",
      "format": "N/A",
      "hash": "sha256:aabbccddeeff0011223344556677889900aabbccddeeff0011223344556677889",
      "collected_date": "2026-07-01",
      "collected_by": "N/A",
      "status": "COLLECTED",
      "notes": "N/A"
    },
    {
      "evidence_id": "EVD-0002",
      "title": "Automated Test Suite Results",
      "type": "Test Report",
      "description": "N/A",
      "location": "https://evidence.satoshium.example/EVD-0002",
      "format": "N/A",
      "hash": "sha256:1122334455667788990011aabbccddeeff1122334455667788990011aabbccdd",
      "collected_date": "2026-07-05",
      "collected_by": "N/A",
      "status": "COLLECTED",
      "notes": "N/A"
    },
    {
      "evidence_id": "EVD-0003",
      "title": "Security Assessment Summary",
      "type": "Security Assessment",
      "description": "N/A",
      "location": "https://evidence.satoshium.example/EVD-0003",
      "format": "N/A",
      "hash": "sha256:ffeeddccbbaa99887766554433221100ffeeddccbbaa99887766554433221100",
      "collected_date": "2026-07-08",
      "collected_by": "N/A",
      "status": "COLLECTED",
      "notes": "N/A"
    }
  ]
}
