{
  "certification_id": "FIXTURE-COMPLETE-0001",
  "generated_date": "2026-07-13",
  "total_items": 1,
  "items": [
    {
      "evidence_id": "FIXTURE-EVD-001",
      "title": "Fixture Source Code Review",
      "type": "Review Report",
      "description": "Source code review report for the complete fixture.",
      "location": "https://evidence.satoshium.test/FIXTURE-EVD-001",
      "format": "PDF",
      "hash": "sha256:fixture000111222333444555666777888999aaabbbccc",
      "collected_date": "2026-07-01",
      "collected_by": "fixture-reviewer",
      "status": "COLLECTED",
      "notes": "Complete fixture evidence item."
    }
  ]
}
